id,user_id,input,base_response,ft_response,ft_promotion_id,base_promotion_id,ft_score,base_score,winner,winner_reason
0,user_091,"{""user_profile"":{""eat_habit"":""Fast eater"",""eat_time_pattern"":""Late night snacker"",""diet"":""No restrictions"",""app_behavior"":""Meal planner"",""meal_frequency"":""3 times/day"",""snack_frequency"":""Never"",""cooking_skill"":""Doesn't cook"",""activity_level"":""Extremely active"",""breakfast_time"":""08:45"",""lunch_time"":""14:45"",""dinner_time"":""17:00"",""app_usage_hours"":""Throughout day"",""notification_preference"":""Off"",""goal_oriented"":false,""social_features_user"":true}}","<think>
Okay, let's see. The user has specific habits and preferences. First, their diet is ""No restrictions,"" so they don't have any dietary issues. They eat late at night, so the time is 14:45, 17:00, and 08:45. Their app behavior is ""Meal planner,"" and they have a meal frequency of 3 times a day. They don't eat a snack, so the app doesn't track that. Their cooking skill is ""Doesn't cook,"" so they might not be interested in cooking. Activity level is extremely active, so they might be interested in social features. They have a goal-oriented status set to false, so they might not be looking for a reward. They also have a social features user set to true, so they might be social.

Now, looking at the promotions. The first one is ""Flash Feast"" which is about getting 50% off between 2 PM and 5 PM. The user's time is 14:45, which is late, so that might not fit. The second is ""Mystery Meal Monday"" which is about getting a surprise dinner. The user's lunch time is 14:45, so maybe that's a time window. The third is ""Snap & Share Sunday"" which encourages sharing photos. The user's social features are true, so that might fit. The fourth is ""Two-for-One Tuesdays"" which gives a free meal. The fifth is ""Weekday Lunch Deal"" which is a combo. The sixth is ""Refer-a-Friend Rewards"" which gives a discount. The seventh is a themed dinner, the eighth is a loyalty program, the ninth is a late-night offer, and the tenth is a family meal bundle.

The user's meal_frequency is 3 times a day, so the promotion that aligns with that would be the one that offers a combo meal. The fifth promotion is a combo, so that's a good fit. The user's activity level is extremely active, so they might want a social feature. The fifth promotion encourages a combo, which could be a social event. The app behavior is meal planner, so the promotion that offers a meal would align with that. The user's app_usage_hours are throughout the day, so the promotion that offers a meal during the day would fit. The fifth promotion is ""Weekday Lunch Deal,"" which includes a combo, so that's a good fit. The reason would be that the promotion is a combo meal, which matches their meal_frequency. The diet is no restrictions, so that's fine. The social features are true, so they would be interested in that. The time window for the promotion is during the day, which aligns with their time. The goal is to get orders, so the promotion that offers a combo meal would be the best fit. The reason would be that the promotion is a combo meal, which matches their meal_frequency and time.
</think>

{""promotion_id"":""5"",""promotion_name"":""Weekday Lunch Deal"",""reason"":""Promotion offers a discounted combo meal aligning with user's 3-day meal frequency, time window (14:45-17:00), and social features, matching their activity level and goal-oriented behavior.""}","<think>
Okay, let's see. The user has a specific profile with certain habits and preferences. The goal is to select the promotion that maximizes expected user engagement. Let me check the user's data again.

The user's eat_habit is ""Fast eater,"" so they're a fast eater. Eat_time_pattern is ""Late night snacker,"" so they're a late-night snacker. Diet is ""No restrictions,"" so no diet restrictions. App_behavior is ""Meal planner,"" so they use the app for meal planning. Meal_frequency is ""3 times/day,"" so they eat three times a day. Snack_frequency is ""Never,"" so they don't snack. Cooking_skill is ""Doesn't cook,"" so they don't cook. Activity_level is ""Extremely active,"" so they're active. Breakfast_time is ""08:45,"" lunch_time is ""14:45,"" dinner_time is ""17:00,"" app_usage_hours is ""Throughout day,"" notification_preference is ""Off,"" goal_oriented is false, and social_features_user is true.

Now, looking at the promotions. Let's check each one. 

Promotion 1: Flash Feast is about getting 50% off between 2 PM and 5 PM. The user's time is late night, so maybe not. 

Promotion 2: Mystery Meal Monday is a dinner promotion. The user's time is late night, so maybe. 

Promotion 3: Snap & Share Sunday is posting photos on social media. The user's time is late night, so maybe. 

Promotion 4: Two-for-One Tuesdays is getting a second meal for free. The user's time is late night, so maybe. 

Promotion 5: Weekday Lunch Deal is a weekday lunch promotion. The user's time is late night, so maybe not. 

Promotion 6: Refer-a-Friend Rewards is inviting a friend. The user's time is late night, so maybe. 

Promotion 7: Themed Dinner Experience is Italy, so maybe. 

Promotion 8: Loyalty Program Launch is earning points. The user's time is late night, so maybe. 

Promotion 9: Late-Night Bites is free delivery after 10 PM. The user's time is late night, so maybe. 

Promotion 10: Family Meal Bundle is two pizzas and soda. The user's time is late night, so maybe. 

Now, check the user's preferences. They're a fast eater, late night snacker, no diet, meal planner app, 3 times/day, never snack, doesn't cook, extremely active, early breakfast, late lunch, late dinner, app throughout day, notification off, goal not, social user. 

Promotion 3 is Snap & Share Sunday, which is posting photos, so social features, so that's a fit. 

Promotion 2 is Mystery Meal Monday, themed dinner, so themed, so fit. 

Promotion 9 is Late-Night Bites, free delivery after 10 PM, so late night, fit. 

Promotion 10 is Family Meal Bundle, family needs, so fit. 

Promotion 5 is Weekday Lunch Deal, weekday lunch, so late night, no, so not. 

Promotion 4 is Two-for-One Tuesdays, participating, so maybe. 

Promotion 6 is Refer-a-Friend, so social, fit. 

Promotion 7 is Themed Dinner, Italy, so themed, fit. 

Promotion 8 is Loyalty, so loyalty, fit. 

Promotion 10 is Family, so family, fit. 

Now, check the user's activities: extremely active, so promotion 3 (Snap & Share) is social, so fit. 

Promotion 2 is themed, so fit. 

Promotion 9 is late night, so fit. 

Promotion 10 is family, so fit. 

So the best fit is promotion 3, 2, 9, 10. Let's check the scoring. 

User's time is late night, so promotion 9 (Late-Night Bites) is late night, so time alignment. User's activity is extremely active, so promotion 3 (Snap & Share) is social, so behavior fit. User's diet is no restrictions, so promotion 2 (Mystery Meal Monday) is themed, so diet compat. User's social features is true, so social fit. User's goal is false, so goal fit. 

So the best fit is promotion 3, 2, 9, 10. Let's check the scoring. 

Time alignment: promotion 9 (Late-Night Bites) is late night, so 0. 

Behavior fit: promotion 3 (Snap & Share) is social, so 0. 

Diet compat: promotion 2 (Mystery Meal Monday) is themed, so 0. 

Social fit: promotion 3, so 0. 

Goal fit: false, so 0. 

So the best fit is promotion 3. Let me check the promotions again. 

Promotion 3 is Snap & Share Sunday, so that's the best fit. So the answer is promotion 3.
</think>

{""promotion_id"":""3"",""promotion_name"":""Snap & Share Sunday"",""reason"":""Promotion aligns with user's late-night snacker preference and social features user (social_features_user: true).""}",3,5,7,8,base,winner aligned with lunch time
1,user_092,"{""user_profile"":{""eat_habit"":""Fast eater"",""eat_time_pattern"":""Late starter (9-11 AM breakfast)"",""diet"":""No restrictions"",""app_behavior"":""Weekly checker"",""meal_frequency"":""1-2 times/day"",""snack_frequency"":""Sometimes"",""cooking_skill"":""Intermediate"",""activity_level"":""Extremely active"",""breakfast_time"":""07:30"",""lunch_time"":""13:30"",""dinner_time"":""20:45"",""app_usage_hours"":""Morning"",""notification_preference"":""Low"",""goal_oriented"":false,""social_features_user"":true}}","<think>
Okay, let's tackle this user profile. The user has a fast eater, eats in the late morning (9-11 AM), no diet restrictions, app behavior is a weekly checker, meal_frequency is 1-2 times a day, snack_frequency is sometimes, cooking skill is intermediate, activity level is extremely active, breakfast time is 7:30, lunch 13:30, dinner 20:45, app usage hours are morning, notification preference is low, goal oriented is false, and social features are true.

First, I need to match these to the promotions. Let's look at the options. The user has a high activity level, so maybe a promotion that encourages social interaction. The app has a high app_usage_hours (morning), which is relevant. The user has a social feature, so maybe a promotion that encourages sharing. 

Looking at the promotions: #3 is ""Post a photo..."". The user's app behavior is a weekly checker, which might align with that. The user's activity is extremely active, so maybe a promotion that encourages sharing. #3's app is to post content, which fits. The user's meal_frequency is 1-2 times a day, so maybe a promotion that offers similar incentives. #1 is a promotion with a time window, but the user's time is 9-11 AM. Wait, the user's lunch is 13:30, which is late, so maybe not. 

Promotion #1: ""Get 50% off..."". The user's time is 9-11 AM, so maybe not. #3: ""Post..."". The user's activity is active, so that's a fit. The app behavior is a weekly checker, which matches. The user has a social feature, so #3. The app_usage_hours is morning, which aligns with the user's. The diet is no restrictions, so no conflict. The goal is to get orders, which is what the promotion is about. The user's meal_frequency is 1-2 times a day, so the promotion might be for that. 

So the best fit would be #3: ""Snap & Share Sunday"". The user's app behavior is a weekly checker, which matches. The promotion encourages sharing, which aligns with their social features. The time window is mentioned, which the user's time is 9-11 AM. The app_usage_hours is morning, which matches their time. The diet is no restrictions, so no conflict. The reason would be that the promotion encourages user-generated content, which fits their social features. 

I need to check if any other promotions fit. #10 is a family meal, but the user's activity is active. #8 is loyalty, but the user's activity is active. #5 is a combo, but the time is 9-11. #2 is a dinner, but the user's time is 9-11. #7 is themed, but the user's time is 9-11. #9 is late-night, but the user's time is 9-11. #4 is a deal, but the time is 9-11. #6 is a referral, but the user's time is 9-11. So the only one that fits is #3. 

So the answer is promotion 3: ""Snap & Share Sunday"". The reason is that it aligns with the user's social features and encourages sharing, which matches their activity level.
</think>

{""promotion_id"":""3"",""promotion_name"":""Snap & Share Sunday"",""reason"":""Promotion encourages user-generated content (social features) and aligns with the user's high activity level, meal timing, and social features, making it the best fit for their habits.""}","<think>
Okay, let's see. The user has a specific profile with certain habits and preferences. The goal is to select the promotion that maximizes expected user engagement. Let me check the user's data again.

The user's eat_habit is a fast eater, eat_time_pattern is late starter (9-11 AM breakfast), diet is no restrictions, app_behavior is weekly checker, meal_frequency is 1-2 times/day, snack_frequency is sometimes, cooking_skill is intermediate, activity_level is extremely active, breakfast_time is 07:30, lunch_time is 13:30, dinner_time is 20:45, app_usage_hours is morning, notification_preference is low, goal_oriented is false, social_features_user is true.

Now, looking at the promotions. Let's check each one. 

Promotion 1: Flash Feast is about getting 50% off between 2 PM and 5 PM. The user's time is 07:30, so that's late, maybe not. 

Promotion 2: Mystery Meal Monday is a dinner promotion. The user's time is 07:30, so maybe late, not. 

Promotion 3: Snap & Share Sunday is posting photos on social media. The user's time is 07:30, so maybe late, not. 

Promotion 4: Two-for-One Tuesdays is getting a second meal for free. The user's time is 07:30, so maybe late, not. 

Promotion 5: Weekday Lunch Deal is a lunch promotion. The user's time is 07:30, so that's lunch, so maybe. 

Promotion 6: Refer-a-Friend Rewards is inviting a friend. The user's time is 07:30, so maybe late, not. 

Promotion 7: Themed Dinner Experience is Italy, the user's time is 07:30, so maybe late, not. 

Promotion 8: Loyalty Program Launch is earning points, the user's time is 07:30, so maybe late, not. 

Promotion 9: Late-Night Bites is midnight snack, the user's time is 07:30, so late, not. 

Promotion 10: Family Meal Bundle is two pizzas, the user's time is 07:30, so family, so maybe. 

Now, check the user's preferences. They have social_features_user true, so promotion 3 (Snap & Share Sunday) might be a good fit. Also, their activity_level is extremely active, so promotion 5 (Weekday Lunch Deal) might be a good fit. Let's check the scoring. 

Time alignment: user's time is 07:30, so promotion 5 (Weekday Lunch Deal) is lunch time, so that's good. Promotion 3's time is Sunday, maybe late, so no. Promotion 1's time is 2 PM, so no. Promotion 4's time is Tuesday, so no. Promotion 5's time is lunch, so yes. Promotion 10's time is midnight, so no. So promotion 5 might be better. Behavior fit: user's activity_level is extremely active, so promotion 5 (Weekday Lunch Deal) might be a good fit. Diet compat: no restrictions, so promotion 5's diet is no restrictions, so okay. Social features user is true, so promotion 3. So maybe promotion 3. Let's check the scoring. Time alignment: user's time is 07:30, promotion 5's time is lunch, so that's good. Behavior fit: user's activity is extremely active, so promotion 5. Diet compat: no restrictions, so promotion 5. Social features user is true, so promotion 3. So the best fit is promotion 3. Let me check the promotions again. Promotion 3's description is post a photo on social media, user's social features is true, so that's a good fit. So the answer is promotion 3.
</think>

{""promotion_id"":""3"",""promotion_name"":""Snap & Share Sunday"",""reason"":""Promotion offers user-generated content (posting photos) aligns with user's social features, and time (Sunday) matches user's breakfast time (07:30).""}",3,3,7,7,tie,Scores tied; both promotions fit similarly based on time/behavior.
2,user_093,"{""user_profile"":{""eat_habit"":""Emotional eater"",""eat_time_pattern"":""Early bird (6-7 AM breakfast)"",""diet"":""Flexitarian"",""app_behavior"":""Deep diver"",""meal_frequency"":""6+ times/day"",""snack_frequency"":""Rarely"",""cooking_skill"":""Beginner"",""activity_level"":""Extremely active"",""breakfast_time"":""10:30"",""lunch_time"":""12:00"",""dinner_time"":""21:00"",""app_usage_hours"":""Afternoon"",""notification_preference"":""Medium"",""goal_oriented"":false,""social_features_user"":true}}","<think>
Okay, let's see. The user has specific habits and preferences. First, I need to check each promotion against their features.

The user's diet is flexitarian, so no issues there. App behavior is deep diver, which means they're probably not a regular user. They have a goal-oriented profile, so maybe they want something that aligns with their goals. Their activity level is extremely active, so the promotion should encourage that.

Looking at the promotions: 1. Flash Feast mentions a 50% discount during peak times, which is 2 PM to 5 PM. But their time is 6-7 AM breakfast. Not matching. 2. Mystery Meal Monday offers a surprise dinner. They have a fixed price, so that's a good fit. 3. Snap & Share Sunday encourages user-generated content. Their activity is active, so this might work. 4. Two-for-One Tuesdays: buy two for free. Their meal_frequency is 6+ times/day, so this could be a good fit. 5. Weekday Lunch Deal: special combo. Their lunch time is 12:00, so this aligns. 6. Refer-a-Friend Rewards: offer $10 off. Their app_usage_hours are after noon, so this might fit. 7. Themed Dinner Experience: Italy, which they might enjoy. 8. Loyalty Program: points, which they might be interested in. 9. Late-Night Bites: midnight, but their time is 6-7 AM. 10. Family Meal Bundle: two pizzas, which they might need. 

The user's app_usage_hours are after noon, so promotion 3 (Snap & Share) would be after they use the app. Their app_behavior is deep diver, so this aligns. The reason they have a strong social features_user, so promotion 3. 

Check the scoring: time alignment (promotion 3's time is after, which matches their 12:00 lunch time. Behavior fit: they are active, so 3. Diet compatible: no conflict. Social fit: strong, so 3. 

So the best fit is promotion 3: Snap & Share Sunday. The reason is that they have strong social features, and the promotion encourages user-generated content, which aligns with their activity level.
</think>

{""promotion_id"":""3"",""promotion_name"":""Snap & Share Sunday"",""reason"":""Promotion aligns with user's strong social features and encourages user-generated content, matching their activity level and goal-oriented behavior.""}","<think>
Okay, let's see. The user has a specific profile with certain habits and preferences. The goal is to select the promotion that maximizes expected user engagement. Let me check the user's data again.

The user's eat_habit is an emotional eater, so they might be a food lover. Eat_time_pattern is early bird (6-7 AM breakfast), so they might be a breakfast lover. Diet is flexitarian, so they don't have a strict diet. App_behavior is a deep diver, so they might be a tech lover. Meal_frequency is 6+ times/day, so they might be a regular eater. Snack_frequency is rarely, so they might be a snack lover. Cooking_skill is a beginner, so they might be a new learner. Activity_level is extremely active, so they might be a active person. Breakfast_time is 10:30, lunch_time is 12:00, dinner_time is 21:00, app_usage_hours is afternoon, notification_preference is medium, goal_oriented is false, social_features_user is true.

Now, looking at the promotions. Let's check each one. 

Promotion 1: Flash Feast is about getting 50% off between 2 PM and 5 PM. The user's time is 6-7 AM breakfast, so that's late, maybe not. 

Promotion 2: Mystery Meal Monday is a dinner promotion. The user's time is 6-7 AM breakfast, so maybe not. 

Promotion 3: Snap & Share Sunday is posting photos on social media. The user's time is 6-7 AM breakfast, so maybe not. 

Promotion 4: Two-for-One Tuesdays is getting a second meal for free. The user's time is 6-7 AM breakfast, so maybe not. 

Promotion 5: Weekday Lunch Deal is a lunch promotion. The user's time is 6-7 AM breakfast, so maybe not. 

Promotion 6: Refer-a-Friend Rewards is inviting a friend. The user's time is 6-7 AM breakfast, so maybe not. 

Promotion 7: Themed Dinner Experience is Italy. The user's time is 6-7 AM breakfast, so maybe not. 

Promotion 8: Loyalty Program Launch is earning points. The user's time is 6-7 AM breakfast, so maybe not. 

Promotion 9: Late-Night Bites is midnight snack. The user's time is 6-7 AM breakfast, so maybe not. 

Promotion 10: Family Meal Bundle is two pizzas. The user's time is 6-7 AM breakfast, so maybe not. 

Now, check the scoring. Time alignment: user's time is 6-7 AM breakfast, so promotion 5 (Weekday Lunch Deal) is lunch time, so that's time alignment. Behavior fit: user's app_behavior is deep diver, so promotion 3 (Snap & Share Sunday) is social, so that's behavior fit. Diet compat: user's diet is flexitarian, so promotion 1 (Flash Feast) is 2 PM, so diet compat. Social fit: user's social_features_user is true, so promotion 3. Household fit: user's activity_level is extremely active, so promotion 5 (Weekday Lunch Deal) is lunch time, so household fit. So the best fit is promotion 5 (Weekday Lunch Deal), which is lunch time, so time alignment. Behavior fit is app_behavior deep diver, so promotion 3. Diet compat is flexitarian, so promotion 1. Social fit is social_features_user, so promotion 3. Household fit is activity_level extremely active, so promotion 5. So the answer is promotion 5.
</think>

{""promotion_id"":""5"",""promotion_name"":""Weekday Lunch Deal"",""reason"":""Promotion aligns with user's lunch time (12:00) and app behavior (deep diver), matching their meal_frequency and activity_level.""}",5,3,8,7,ft,winner aligned with lunch time
