id,user_id,input,base_response,ft_response,ft_promotion_id,base_promotion_id,ft_score,base_score,winner,winner_reason
5,user_096,"{""user_profile"":{""eat_habit"":""Emotional eater"",""eat_time_pattern"":""3 large meals"",""diet"":""Pescatarian"",""app_behavior"":""Deep diver"",""meal_frequency"":""6+ times/day"",""snack_frequency"":""Never"",""cooking_skill"":""Beginner"",""activity_level"":""Very active"",""breakfast_time"":""09:15"",""lunch_time"":""14:30"",""dinner_time"":""21:30"",""app_usage_hours"":""Afternoon"",""notification_preference"":""Low"",""goal_oriented"":false,""social_features_user"":false}}","<think>
Okay, let's see. The user has specific habits and preferences. First, I need to check the data provided. The user's eat_habit is Emotional eater, eat_time_pattern is 3 large meals, diet is Pescatarian, app_behavior is Deep diver, meal_frequency is 6+ times/day, snack_frequency is Never, cooking_skill is Beginner, activity_level is Very active, breakfast_time is 09:15, lunch_time 14:30, dinner_time 21:30, app_usage_hours are Afternoon, notification_preference is Low, goal_oriented is false, social_features_user is false.

Looking at the promotions, I need to find one that matches these criteria. Let's go through each.

Promotion 1: Flash Feast. It says ""Get 50% off all orders between 2 PM and 5 PM on weekdays."" The user's time is 09:15, which is breakfast, so this might not fit. The time window is 2 PM-5 PM, but the user's time is 09:15, which is not in that window. So maybe not.

Promotion 2: Mystery Meal Monday. ""Let us pick your dinner! Get a surprise main course from a top-rated local restaurant for a fixed price of $10."" The user's meal_frequency is 6+ times/day, so this might be a good fit. They have a fixed price, which matches the promotion. The app behavior is Deep diver, which could relate to the user's activity. The user's app_usage_hours are Afternoon, so this might align with their time.

Promotion 3: Snap & Share Sunday. ""Post a photo of your meal ordered through our app on social media, tag us, and use our special hashtag for a chance to win a $50 gift card."" The user's app behavior is Deep diver, so this could be a social promotion. The user has a high activity level, so this might fit.

Promotion 4: Two-for-One Tuesdays. ""Buy one main course and get a second one of equal or lesser value for free from participating restaurants."" The user's meal_frequency is 6+ times/day, so this might be a good fit for a free offer.

Promotion 5: Weekday Lunch Deal. ""To attract the weekday lunch crowd, we're offering a special combo: a main dish, a side, and a drink for a discounted price."" The user has 6+ times/day, so this could be a lunch promotion.

Promotion 6: Refer-a-Friend Rewards. ""Invite a friend to the app and you both get $10 off your next order."" The user's app behavior is Deep diver, so this could be a referral promotion.

Promotion 7: Themed Dinner Experience. ""This week, explore the tastes of Italy with our 'Taste of Tuscany' promotion, featuring exclusive dishes and discounts from local Italian restaurants."" The user's diet is Pescatarian, which is a cuisine, so this might fit.

Promotion 8: Loyalty Program Launch. ""Earn points for every dollar you spend. Accumulate 500 points and receive a $15 credit."" The user's app behavior is Deep diver, so this could relate to a loyalty program.

Promotion 9: Late-Night Bites. ""Craving a midnight snack? Get free delivery on all orders placed after 10 PM."" The user's time is 21:30, which is dinner, so this might not fit.

Promotion 10: Family Meal Bundle. ""Perfect for a family night in, get two large pizzas, a side of garlic bread, and a 2-liter soda for a special bundled price."" The user's activity_level is Very active, so this could be a family meal promotion.

Now, applying the scoring. Let's check each:

Promotion 2: Time alignment? The user's time is 09:15, which is breakfast. The promotion is for 2 PM-5 PM. Not matching. So time alignment is 0.

Behavior fit: The user has 6+ times/day, so this promotion is for a combo, which fits.

Diet compatibility: The user's diet is Pescatarian, and the promotion is about a dinner experience, which might not conflict. The promotion is for a dinner, so maybe not. Wait, the user's diet is Pescatarian, which is a type of diet, so maybe the promotion is themed around a meal. The promotion 7 is ""Taste of Tuscany"" which is a themed cuisine, so that might fit.

Social features: The user has no social features, so this might not fit.

Household fit: The user is a very active person, so this promotion would be for a family meal, which they might be a family. The promotion 10 is for a family meal bundle.

Now, applying the scoring. Let's go through each:

Promotion 2: time_alignment 0, behavior_fit 1, diet_compat 0, social_fit 0, household_fit 1. So total 0+1+0+0+1=2.

Promotion 3: time 0, behavior 1, diet 0, social 0, household 1. Total 1.

Promotion 5: time 0, behavior 1, diet 0, social 0, household 1. Total 1.

Promotion 7: time 0, behavior 1, diet 0, social 0, household 1. Total 1.

Promotion 10: time 0, behavior 1, diet 0, social 0, household 1. Total 1.

Promotion 2: total 2.

Which one is the best? The user's app behavior is Deep diver, which is for social engagement. Promotion 3 is ""Snap & Share Sunday"" which aligns with that. So the best fit would be promotion 3. Let me check the other options again.

Promotion 3: ""Snap & Share Sunday"" - posts meal orders, which matches the user's activity. The user has no social features, so this is a social promotion. The user's app behavior is Deep diver, so this fits. The time is 21:30, which is dinner, so this matches. The promotion is for a social media engagement. The user's activity_level is very active, so this would be a good fit. The diet is Pescatarian, which is a type of diet, so the promotion is themed around a meal. The user's meal_frequency is 6+ times/day, so this is a combo. The app_usage_hours are Afternoon, which matches the user's time. The notification_preference is low, so this might not be a high priority. The user's goal is to get a meal, so this is a social promotion. The best fit is promotion 3.
</think>

{""promotion_id"":""3"",""promotion_name"":""Snap & Share Sunday"",""reason"":""Promotion aligns with user's high activity level, offers a social engagement incentive, and matches their 6+ meal frequency, while emphasizing a themed dinner experience.""}","<think>
Okay, let's see. The user has a specific profile with certain habits and preferences. The goal is to select the promotion that maximizes expected user engagement. Let me check the user's data again.

The user's eat_habit is an emotional eater, eat_time_pattern is 3 large meals, diet is pescatarian, app_behavior is deep diver, meal_frequency is 6+ times/day, snack_frequency is never, cooking_skill is beginner, activity_level is very active, breakfast_time is 09:15, lunch_time is 14:30, dinner_time is 21:30, app_usage_hours is afternoon, notification_preference is low, goal_oriented is false, social_features_user is false.

Now, looking at the promotions. Let's check each one. 

Promotion 1: Flash Feast is about getting 50% off between 2 PM and 5 PM. The user's time is 14:30, which is late, so maybe not. 

Promotion 2: Mystery Meal Monday is a dinner promotion. The user's lunch time is 14:30, so maybe this is a good fit. 

Promotion 3: Snap & Share Sunday is posting photos on social media. The user's social features are false, so maybe not. 

Promotion 4: Two-for-One Tuesdays is getting a second meal for free. The user's meal frequency is 6+ times/day, so maybe this is a good fit. 

Promotion 5: Weekday Lunch Deal is a lunch promotion. The user's lunch time is 14:30, so this might be a good fit. 

Promotion 6: Refer-a-Friend Rewards is inviting a friend. The user's social features are false, so maybe not. 

Promotion 7: Themed Dinner Experience is Italy, the user's diet is pescatarian, so maybe this is a good fit. 

Promotion 8: Loyalty Program Launch is earning points, the user's goal oriented is false, so maybe not. 

Promotion 9: Late-Night Bites is midnight snack, the user's time is 21:30, so maybe not. 

Promotion 10: Family Meal Bundle is two pizzas, the user's activity level is very active, so maybe this is a good fit. 

Now, check the scoring. Time alignment: user's lunch time is 14:30, promotion 2's time is Monday, so maybe. Behavior fit: app_behavior is deep diver, so promotion 2's app behavior is snap, so maybe. Diet compat: diet is pescatarian, promotion 7's theme is Italy, so maybe. Social fit: social features user is false, so none. Household fit: family needs, user's activity level is very active, so maybe. 

So the best fit is promotion 2 (Mystery Meal Monday), promotion 4 (Two-for-One Tuesdays), promotion 5 (Weekday Lunch Deal), promotion 7 (Themed Dinner Experience), promotion 10 (Family Meal Bundle). 

Now apply the scoring. Time alignment: user's lunch time is 14:30, promotion 2's time is Monday, so maybe. Behavior fit: app_behavior is deep diver, promotion 2's app behavior is snap, so maybe. Diet compat: diet is pescatarian, promotion 7's theme is Italy, so maybe. Social fit: social features user is false, so none. Household fit: family needs, user's activity level is very active, so maybe. 

So the best fit is promotion 2, 4, 5, 7, 10. Let's check the scoring. Time alignment: user's lunch time is 14:30, promotion 2's time is Monday, so maybe. Behavior fit: app_behavior is deep diver, promotion 2's app behavior is snap, so maybe. Diet compat: diet is pescatarian, promotion 7's theme is Italy, so maybe. Social fit: social features user is false, so none. Household fit: family needs, user's activity level is very active, so maybe. 

So the best is promotion 2. Let me check the promotions again. Promotion 2 is Mystery Meal Monday, which is a dinner promotion. The user's diet is pescatarian, so maybe. Promotion 4 is Two-for-One Tuesdays, which is getting a second meal, so maybe. Promotion 5 is Weekday Lunch Deal, which is a lunch promotion, so maybe. Promotion 7 is Themed Dinner Experience, which is Italy, so maybe. Promotion 10 is Family Meal Bundle, which is two pizzas, so maybe. 

So the best fit is promotion 2, 4, 5, 7, 10. Let's check the scoring. Time alignment: user's lunch time is 14:30, promotion 2's time is Monday, so maybe. Behavior fit: app_behavior is deep diver, promotion 2's app behavior is snap, so maybe. Diet compat: diet is pescatarian, promotion 7's theme is Italy, so maybe. Social fit: social features user is false, so none. Household fit: family needs, user's activity level is very active, so maybe. 

So the best is promotion 2. Let me check the promotions again. Promotion 2 is Mystery Meal Monday, which is a dinner promotion. The user's diet is pescatarian, so maybe. Promotion 4 is Two-for-One Tuesdays, which is getting a second meal, so maybe. Promotion 5 is Weekday Lunch Deal, which is a lunch promotion, so maybe. Promotion 7 is Themed Dinner Experience, which is Italy, so maybe. Promotion 10 is Family Meal Bundle, which is two pizzas, so maybe. 

So the best fit is promotion 2, 4, 5, 7, 10. Let's check the scoring. Time alignment: user's lunch time is 14:30, promotion 2's time is Monday, so maybe. Behavior fit: app_behavior is deep diver, promotion 2's app behavior is snap, so maybe. Diet compat: diet is pescatarian, promotion 7's theme is Italy, so maybe. Social fit: social features user is false, so none. Household fit: family needs, user's activity level is very active, so maybe. 

So the best is promotion 2. Let me check the promotions again. Promotion 2 is Mystery Meal Monday, which is a dinner promotion. The user's diet is pescatarian, so maybe. Promotion 4 is Two-for-One Tuesdays, which is getting a second meal, so maybe. Promotion 5 is Weekday Lunch Deal, which is a lunch promotion, so maybe. Promotion 7 is Themed Dinner Experience, which is Italy, so maybe. Promotion 10 is Family Meal Bundle, which is two pizzas, so maybe. 

So the best fit is promotion 2, 4, 5, 7, 10. Let's check the scoring. Time alignment: user's lunch time is 14:30, promotion 2's time is Monday, so maybe. Behavior fit: app_behavior is deep diver, promotion 2's app behavior is snap, so maybe. Diet compat: diet is pescatarian, promotion 7's theme is Italy, so maybe. Social fit: social features user is false, so none. Household fit: family needs, user's activity level is very active, so maybe. 

So the best is promotion 2. Let me check the promotions again. Promotion 2 is Mystery Meal Monday, which is a dinner promotion. The user's diet is pescatarian, so maybe. Promotion 4 is Two-for-One Tuesdays, which is getting a second meal, so maybe. Promotion 5 is Weekday Lunch Deal, which is a lunch promotion, so maybe. Promotion 7 is Themed Dinner Experience, which is Italy, so maybe. Promotion 10 is Family Meal Bundle, which is two pizzas, so maybe. 

So the best fit is promotion 2, 4, 5, 7, 10. Let's check the scoring. Time alignment: user's lunch time is 14:30, promotion 2's time is Monday, so maybe. Behavior fit: app_behavior is deep diver, promotion 2's app behavior is snap, so maybe. Diet compat: diet is pescatarian, promotion 7's theme is Italy, so maybe. Social fit: social features user is false, so none. Household fit: family needs, user's activity level is very active, so maybe. 

So the best is promotion 2. Let me check the promotions again. Promotion 2 is Mystery Meal Monday, which is a dinner promotion. The user's diet is pescatarian, so maybe. Promotion 4 is Two-for-One Tuesdays, which is getting a second meal, so maybe. Promotion 5 is Weekday Lunch Deal, which is a lunch promotion, so maybe. Promotion 7 is Themed Dinner Experience, which is Italy, so maybe. Promotion 10 is Family Meal Bundle, which is two pizzas, so maybe. 

So the best fit is promotion 2, 4, 5, 7, 10. Let's check the scoring. Time alignment: user's lunch time is 14:30, promotion 2's time is Monday, so maybe. Behavior fit: app_behavior is deep diver, promotion 2's app behavior is snap, so maybe. Diet compat: diet is pescatarian, promotion 7's",,3,0,5,base,higher combined time/behavior/diet score
