id,user_id,input,base_response,ft_response,ft_promotion_id,base_promotion_id,ft_score,base_score,winner,winner_reason
3,user_094,"{""user_profile"":{""eat_habit"":""Slow eater"",""eat_time_pattern"":""Night owl (late dinner)"",""diet"":""Keto"",""app_behavior"":""Community participant"",""meal_frequency"":""3 times/day"",""snack_frequency"":""Often"",""cooking_skill"":""Doesn't cook"",""activity_level"":""Extremely active"",""breakfast_time"":""08:15"",""lunch_time"":""13:45"",""dinner_time"":""18:30"",""app_usage_hours"":""Afternoon"",""notification_preference"":""Medium"",""goal_oriented"":false,""social_features_user"":true}}","<think>
Okay, let's tackle this user profile. The user has a diet of Keto, eat_habit is a slow eater, and they're active. They mention they're a night owl, so their activity is likely to be active during the night. The app behavior is a community participant, so they're likely to use the app. They have meal_frequency of 3 times/day, which includes lunch, dinner, and snacks. Their snack_frequency is often, so they might be more active with that. Their diet is Keto, so they might prefer a menu that's low in carbs. App_usage_hours are after noon, so the promotion's time window is likely to be after 10 PM, which is when they might be active. They have a goal_oriented flag set to false, so they might not be focused on the app's features. Their social_features_user is true, so they might be social. The diet compatibility is Keto, so they might be okay with that. The time alignment is after 10 PM, so the promotion's time window is likely to be during that time. The behavior fit is that they have a routine, so the promotion's time window is likely to be during that time. The social fit is true. The scoring is time_alignment (0-3) + behavior_fit (0-3) + diet_compat (0 or 3) + social_fit (0-2 if strong) + household_fit (0-2). The best fit would be the one that matches all these. Let's check each promotion. The user's app_usage_hours are after noon, so promotion 10 is ""Late-Night Bites"" which is after 10 PM, so time alignment is 3. App behavior is community participant, so behavior fit is 3. Diet is Keto, so diet_compat is 3. Social features are true, so social_fit is 2. Household fit is for a night owl, so 2. That's the best. So the answer is promotion 10.
</think>

{""promotion_id"":""10"",""promotion_name"":""Late-Night Bites"",""reason"":""Promotion aligns with the user's time window (10 PM), diet (Keto), and activity (night owl), while offering a discounted meal, matching their activity level and meal habits.""}","<think>
Okay, let's see. The user has a specific profile with certain habits and preferences. The goal is to select the promotion that maximizes expected user engagement. Let me check the user's data again.

The user's eat_habit is a slow eater, eat_time_pattern is night owl (late dinner), diet is keto, app_behavior is community participant, meal_frequency is 3 times/day, snack_frequency is often, cooking_skill is doesn't cook, activity_level is extremely active, breakfast_time is 08:15, lunch_time is 13:45, dinner_time is 18:30, app_usage_hours is afternoon, notification_preference is medium, goal_oriented is false, social_features_user is true.

Now, looking at the promotions. Let's check each one. 

Promotion 1: Flash Feast is about getting 50% off between 2 PM and 5 PM. The user's time is night owl (18:30), so that's late, maybe not. 

Promotion 2: Mystery Meal Monday is a dinner promotion. The user's diet is keto, so maybe that's a fit. 

Promotion 3: Snap & Share Sunday is posting photos on social media. The user's social_features_user is true, so that's a fit. 

Promotion 4: Two-for-One Tuesdays is getting a second meal for free. The user's diet is keto, so maybe not. 

Promotion 5: Weekday Lunch Deal is a weekday lunch promotion. The user's time is night owl, so that's late, maybe not. 

Promotion 6: Refer-a-Friend Rewards is inviting a friend. The user's social_features_user is true, so that's a fit. 

Promotion 7: Themed Dinner Experience is Italy, the user's diet is keto, so maybe not. 

Promotion 8: Loyalty Program Launch is earning points, the user's goal_oriented is false, so maybe not. 

Promotion 9: Late-Night Bites is free delivery after 10 PM, the user's time is night owl (18:30), so that's late, maybe not. 

Promotion 10: Family Meal Bundle is two pizzas, the user's activity_level is extremely active, so maybe that's a fit. 

Now, check the scoring. Time alignment: user's time is night owl (18:30), so promotion 1's time is 2 PM (13:45), so maybe not. Promotion 2's time is Monday, so maybe not. Promotion 3's time is Sunday, so maybe not. Promotion 4's time is Tuesdays, so maybe not. Promotion 5's time is weekday, so maybe not. Promotion 6's time is Sunday, so maybe not. Promotion 7's time is Themed, so maybe not. Promotion 8's time is Loyalty, so maybe not. Promotion 9's time is Late-Night, so maybe not. Promotion 10's time is Family, so maybe. 

Behavior fit: user's activity_level is extremely active, so promotion 10's family meal bundle might be a fit. Diet is keto, so promotion 2's dinner might be keto. 

Social features user is true, so promotion 3. 

So the best fit is promotion 10 (Family Meal Bundle) because user's activity_level is extremely active, and promotion 10's family meal bundle is for a family night in, so that's a fit. Let me check the scoring. Time alignment: user's time is night owl (18:30), promotion 10's time is late night (18:30), so time alignment. Behavior fit: user's activity_level is extremely active, promotion 10's family meal bundle is for a family, so behavior fit. Diet compat: user's diet is keto, promotion 2's dinner is themed Italy, so diet compat? Wait, user's diet is keto, so promotion 2's dinner is Italy, which is not keto, so diet compat might be no. Social features user is true, so promotion 3. So the best is promotion 10. So the reason is the user's activity_level is extremely active, so promotion 10.
</think>

{""promotion_id"":""10"",""promotion_name"":""Family Meal Bundle"",""reason"":""User's activity_level is extremely active, matching promotion 10's family meal bundle."",""promotion_id"":""10"",""promotion_name"":""Family Meal Bundle"",""reason"":""User's activity_level is extremely active, matching promotion 10's family meal bundle.""}",10,10,5,5,tie,Scores tied; both promotions fit similarly based on time/behavior.
4,user_095,"{""user_profile"":{""eat_habit"":""Slow eater"",""eat_time_pattern"":""Late night snacker"",""diet"":""Pescatarian"",""app_behavior"":""Streaky user"",""meal_frequency"":""3 times/day"",""snack_frequency"":""Sometimes"",""cooking_skill"":""Advanced"",""activity_level"":""Extremely active"",""breakfast_time"":""07:45"",""lunch_time"":""11:30"",""dinner_time"":""18:00"",""app_usage_hours"":""Evening"",""notification_preference"":""Medium"",""goal_oriented"":true,""social_features_user"":false}}","<think>
Okay, let's see. The user has specific habits and preferences. First, their diet is Pescatarian, which is a type of diet, so that's a diet compatibility check. They eat late at night, so time alignment is important. Their app behavior is streaky, meaning they might be clicking on the app multiple times. They have a meal_frequency of 3 times a day, so they might be eating more often. Their snack_frequency is sometimes, so maybe they like snacks. Their cooking skill is advanced, so maybe they enjoy cooking. Activity_level is extremely active, which could mean they're more likely to engage with the app. They have a goal-oriented profile, so they might be looking for something that meets their goals. Their social features are social features user, but the input says they are social features user, so maybe that's a check. Wait, the user's social_features_user is false, but the input says ""social_features_user"": false. So the input says ""social_features_user"": false. The user's profile says ""social_features_user"": false. So the answer should check those.

Looking at the promotions, let's check each one. 

Promotion 1: ""Flash Feast: ..."". Time window is mentioned as 2 PM to 5 PM. The user's time is 18:00, which is late, so maybe not. But the time window is during weekdays, and the user's time is 18:00, which is 6 PM, so maybe not. 

Promotion 2: ""Mystery Meal Monday: ..."". The description says ""Let us pick your dinner! Get a surprise main course..."" So maybe they like dinners. The user's meal_frequency is 3 times a day, so this might fit. 

Promotion 3: ""Snap & Share Sunday: ..."". Encourages user-generated content. The user's activity is active, so maybe this. 

Promotion 4: ""Two-for-One Tuesdays: ..."". Offers a free second meal. The user's meal_frequency is 3 times a day, so this might fit. 

Promotion 5: ""Weekday Lunch Deal: ..."". Special combo for weekday lunch. The user's lunch_time is 11:30, so this fits. 

Promotion 6: ""Refer-a-Friend Rewards: ..."". Offers a discount. The user's app_behavior is streaky, so this could be. 

Promotion 7: ""Themed Dinner Experience: ..."". Themed with Italy, so maybe. 

Promotion 8: ""Loyalty Program Launch: ..."". Encourages repeat business. The user's activity_level is extremely active, so this might fit. 

Promotion 9: ""Late-Night Bites: ..."". Offers free delivery after 10 PM. The user's time is 18:00, which is 6 PM, so this might not fit. 

Promotion 10: ""Family Meal Bundle: ..."". For a family, so this fits. 

Now, applying the scoring. Let's check each. 

Diet: Pescatarian, so check. 

Time alignment: The user's time is 18:00, which is late, so promotion 1's time window is 2 PM to 5 PM. Not matching. 

Behavior fit: The user has a 3-day meal frequency, so promotion 5's time is weekday. 

Social features: The user's social features are false, so no. 

Diet compatible: Yes. 

Social_fit: The user's app behavior is streaky, so promotion 3. 

Household fit: The user's activity is active, so promotion 6. 

Now, apply the scoring. Let's see. 

Time_alignment: 0-3. The user's time is 18:00, which is 6 PM, so the promotion's time window is 2 PM to 5 PM. So time alignment is not. 

Wait, the user's time is 18:00, which is 6 PM, so the promotion's time window is 2 PM to 5 PM. So the time is not aligned. 

But the user's time is 18:00, which is 6 PM, so the promotion's time window is 2 PM to 5 PM. So the time is not aligned. 

So time_alignment is 0. 

Behavior_fit: The user has a 3-day meal frequency, so promotion 5. 

Diet_compat: Yes. 

Social_fit: The user's app behavior is streaky, so promotion 3. 

Household_fit: The user's activity is active, so promotion 6. 

So the scoring would be: time_alignment (0), behavior_fit (1), diet_compat (0), social_fit (1), household_fit (1). 

But the user's profile says their app_usage_hours is ""Evening"", so the user is active during evening, which is 6 PM. 

Promotion 3: ""Snap & Share Sunday"" has a time window of 2 PM to 5 PM. The user's time is 6 PM, so this might not fit. Wait, the user's time is 18:00, which is 6 PM. The promotion's time window is 2 PM to 5 PM. So the time is not aligned. 

Hmm, maybe I made a mistake here. Let's check again. 

The user's lunch_time is 11:30, which is 11:30, so the promotion's time window is 2 PM to 5 PM. The user's time is 11:30, so that's not. The user's time is 18:00, which is 6 PM. So the promotion's time window is 2 PM to 5 PM, which is 5 PM, so the user's time is 6 PM. So time is not aligned. 

So time_alignment is 0. 

Then, behavior_fit: The user has a 3-day meal frequency, so promotion 5. 

Diet_compat: Yes. 

Social_fit: The user's app behavior is streaky, so promotion 3. 

Household_fit: The user's activity is active, so promotion 6. 

So the scoring would be: time_alignment (0), behavior_fit (1), diet_compat (0), social_fit (1), household_fit (1). 

But the user's app_usage_hours is ""Evening"", so the user is active during evening. 

Promotion 3: ""Snap & Share Sunday"" has a time window of 2 PM to 5 PM. The user's time is 6 PM, so this doesn't fit. 

Wait, maybe the time is aligned. The user's lunch_time is 11:30, which is 11:30. The promotion's time window is 2 PM to 5 PM. So the user's time is 11:30, which is 11:30, so that's not. 

Hmm, this is a problem. Maybe I need to check each promotion again. 

Promotion 5: ""Weekday Lunch Deal: ..."". The description says ""special combo: main dish, side, and drink for a discounted price"". The user's lunch_time is 11:30, so this fits. 

So time_alignment: 0. 

Behavior_fit: The user has 3 meal times, so promotion 5. 

Diet_compat: Yes. 

Social_fit: The user's app behavior is streaky, so promotion 3. 

Household_fit: The user's activity is active, so promotion 6. 

So the scoring would be: time_alignment (0), behavior_fit (1), diet_compat (0), social_fit (1), household_fit (1). 

But the user's app_usage_hours is ""Evening"", which is 6 PM. 

Promotion 3: ""Snap & Share Sunday"" has a time window of 2 PM to 5 PM. The user's time is 6 PM, so this doesn't fit. 

Wait, maybe the time is aligned. The user's lunch_time is 11:30, which is 11:30. The promotion's time window is 2 PM to 5 PM. So the time is not aligned. 

This is a problem. 

Alternatively, maybe the time is aligned. Let's check the promotions again. 

Promotion 5: ""Weekday Lunch Deal"" says ""special combo: main dish, side, and drink for a discounted price"". The user's lunch_time is 11:30, so this fits. 

So time_alignment: 0. 

So the answer would be promotion 5. 

But the user's app_usage_hours is ""Evening"", which is 6 PM. 

So the time is 11:30, which is 11:30, so the time is not aligned. 

Hmm, I think I need to check each promotion again. 

Promotion 5: ""Weekday Lunch Deal"" is for weekday lunch, which matches the user's lunch_time of 11:30. So time is aligned. 

So time_alignment is 0. 

So the best option would be promotion 5. 

But the user's app_behavior is streaky, so promotion 6. 

Wait, the user's app_behavior is streaky, so promotion 6. 

But the time is 11:30, which is 11:30, so the time is not aligned. 

This is confusing. 

Maybe the time is aligned","<think>
Okay, let's see. The user has a specific profile with certain habits and preferences. The goal is to select the promotion that maximizes expected user engagement. Let me check the user's data again.

The user's eat_habit is a slow eater, eat_time_pattern is a late night snacker, diet is pescatarian, app_behavior is streaky user, meal_frequency is 3 times/day, snack_frequency is sometimes, cooking_skill is advanced, activity_level is extremely active, breakfast_time is 07:45, lunch_time is 11:30, dinner_time is 18:00, app_usage_hours is evening, notification_preference is medium, goal_oriented is true, social_features_user is false.

Now, looking at the promotions. Let's check each one. 

Promotion 1: Flash Feast is about getting 50% off between 2 PM and 5 PM. The user's time is late night, so maybe not. 

Promotion 2: Mystery Meal Monday is a dinner promotion. The user's diet is pescatarian, so maybe. 

Promotion 3: Snap & Share Sunday is posting photos on social media. The user's social_features_user is false, so maybe not. 

Promotion 4: Two-for-One Tuesdays is getting a second meal for free. The user's diet is pescatarian, so maybe. 

Promotion 5: Weekday Lunch Deal is a weekday lunch promotion. The user's lunch_time is 11:30, so maybe. 

Promotion 6: Refer-a-Friend Rewards is inviting a friend. The user's app_behavior is streaky, so maybe. 

Promotion 7: Themed Dinner Experience is Italy, the user's diet is pescatarian, so maybe. 

Promotion 8: Loyalty Program Launch is earning points, the user's goal_oriented is true, so maybe. 

Promotion 9: Late-Night Bites is midnight snack, the user's eat_time_pattern is late night, so maybe. 

Promotion 10: Family Meal Bundle is two pizzas, the user's activity_level is extremely active, so maybe. 

Now, check the scoring. Time alignment: user's eat_time_pattern is late night, so promotion 9 (Late-Night Bites) might fit. Behavior fit: app_behavior is streaky, so promotion 6 (Refer-a-Friend Rewards) might fit. Diet compat: diet is pescatarian, promotion 2 (Mystery Meal Monday) might fit. Social fit: social_features_user is false, so none. Household fit: family needs, user's activity_level is extremely active, so promotion 10 (Family Meal Bundle) might fit. So the best fit is promotion 9 (Late-Night Bites), which aligns with the user's late night snack preference. So the answer is promotion 9.
</think>

{""promotion_id"":""9"",""promotion_name"":""Late-Night Bites"",""reason"":""Promotion aligns with user's late night snacker preference (18:00 dinner time) and diet (pescatarian), matching their activity level (extremely active).""}",9,,8,0,ft,winner aligned with late-night pattern
